{
  "project_id": "2026-09-26_bip-e2e-basic",
  "edit_preset": "talking-head-basic",
  "output": {
    "width": 1080,
    "height": 1920,
    "fps": 30
  },
  "sources": {
    "cam": "raw/cam.mp4",
    "mic": "raw/mic.wav",
    "mic_offset_ms": 411.9
  },
  "segments": [
    {
      "src": "cam",
      "in": 4.3,
      "out": 6.803,
      "beat": null,
      "reframe": "face_track",
      "zoom": {
        "from": 1.0,
        "to": 1.0,
        "ease": "linear"
      },
      "overlay_broll": null
    },
    {
      "src": "cam",
      "in": 7.69,
      "out": 10.011,
      "beat": null,
      "reframe": "face_track",
      "zoom": {
        "from": 1.15,
        "to": 1.15,
        "ease": "linear"
      },
      "overlay_broll": null
    },
    {
      "src": "cam",
      "in": 11.624,
      "out": 15.666,
      "beat": null,
      "reframe": "face_track",
      "zoom": {
        "from": 1.0,
        "to": 1.07,
        "ease": "easeInOut"
      },
      "overlay_broll": null
    },
    {
      "src": "cam",
      "in": 16.44,
      "out": 20.008,
      "beat": null,
      "reframe": "face_track",
      "zoom": {
        "from": 1.15,
        "to": 1.22,
        "ease": "easeInOut"
      },
      "overlay_broll": null
    },
    {
      "src": "cam",
      "in": 21.28,
      "out": 21.909,
      "beat": null,
      "reframe": "face_track",
      "zoom": {
        "from": 1.0,
        "to": 1.0,
        "ease": "linear"
      },
      "overlay_broll": null
    },
    {
      "src": "cam",
      "in": 22.05,
      "out": 23.306,
      "beat": null,
      "reframe": "face_track",
      "zoom": {
        "from": 1.15,
        "to": 1.15,
        "ease": "linear"
      },
      "overlay_broll": null
    }
  ],
  "captions": {
    "style": "talking-head-basic",
    "enabled": true,
    "size": 1.0,
    "max_words": 3,
    "words": [
      {
        "text": "This",
        "start": 0.06,
        "end": 0.282,
        "src_start": 4.36,
        "highlight": false
      },
      {
        "text": "took",
        "start": 0.302,
        "end": 0.524,
        "src_start": 4.602,
        "highlight": false
      },
      {
        "text": "me",
        "start": 0.544,
        "end": 0.677,
        "src_start": 4.844,
        "highlight": false
      },
      {
        "text": "three",
        "start": 0.689,
        "end": 0.956,
        "src_start": 4.989,
        "highlight": false
      },
      {
        "text": "hours",
        "start": 0.979,
        "end": 1.246,
        "src_start": 5.279,
        "highlight": false
      },
      {
        "text": "instead",
        "start": 1.269,
        "end": 1.625,
        "src_start": 5.569,
        "highlight": false
      },
      {
        "text": "of",
        "start": 1.656,
        "end": 1.79,
        "src_start": 5.956,
        "highlight": false
      },
      {
        "text": "three",
        "start": 1.801,
        "end": 2.068,
        "src_start": 6.101,
        "highlight": false
      },
      {
        "text": "weeks.",
        "start": 2.091,
        "end": 2.403,
        "src_start": 6.391,
        "highlight": false
      },
      {
        "text": "I",
        "start": 2.55,
        "end": 2.644,
        "src_start": 7.75,
        "highlight": false
      },
      {
        "text": "rebuilt",
        "start": 2.652,
        "end": 3.027,
        "src_start": 7.852,
        "highlight": false
      },
      {
        "text": "the",
        "start": 3.059,
        "end": 3.247,
        "src_start": 8.259,
        "highlight": false
      },
      {
        "text": "whole",
        "start": 3.263,
        "end": 3.544,
        "src_start": 8.463,
        "highlight": false
      },
      {
        "text": "onboarding",
        "start": 3.569,
        "end": 4.084,
        "src_start": 8.769,
        "highlight": false
      },
      {
        "text": "flow",
        "start": 4.129,
        "end": 4.363,
        "src_start": 9.329,
        "highlight": false
      },
      {
        "text": "today.",
        "start": 4.383,
        "end": 4.711,
        "src_start": 9.583,
        "highlight": false
      },
      {
        "text": "the",
        "start": 4.807,
        "end": 4.991,
        "src_start": 11.64,
        "highlight": false
      },
      {
        "text": "trick",
        "start": 5.007,
        "end": 5.283,
        "src_start": 11.84,
        "highlight": false
      },
      {
        "text": "was",
        "start": 5.307,
        "end": 5.491,
        "src_start": 12.14,
        "highlight": false
      },
      {
        "text": "letting",
        "start": 5.507,
        "end": 5.875,
        "src_start": 12.34,
        "highlight": false
      },
      {
        "text": "Claude",
        "start": 5.907,
        "end": 6.229,
        "src_start": 12.74,
        "highlight": true
      },
      {
        "text": "write",
        "start": 6.257,
        "end": 6.533,
        "src_start": 13.09,
        "highlight": false
      },
      {
        "text": "the",
        "start": 6.557,
        "end": 6.741,
        "src_start": 13.39,
        "highlight": false
      },
      {
        "text": "boring",
        "start": 6.757,
        "end": 7.079,
        "src_start": 13.59,
        "highlight": false
      },
      {
        "text": "parts",
        "start": 7.107,
        "end": 7.383,
        "src_start": 13.94,
        "highlight": false
      },
      {
        "text": "while",
        "start": 7.407,
        "end": 7.683,
        "src_start": 14.24,
        "highlight": false
      },
      {
        "text": "I",
        "start": 7.707,
        "end": 7.799,
        "src_start": 14.54,
        "highlight": false
      },
      {
        "text": "designed",
        "start": 7.807,
        "end": 8.221,
        "src_start": 14.64,
        "highlight": false
      },
      {
        "text": "the",
        "start": 8.257,
        "end": 8.441,
        "src_start": 15.09,
        "highlight": false
      },
      {
        "text": "flow.",
        "start": 8.457,
        "end": 8.733,
        "src_start": 15.29,
        "highlight": false
      },
      {
        "text": "Signups",
        "start": 8.9,
        "end": 9.526,
        "src_start": 16.5,
        "highlight": false
      },
      {
        "text": "went",
        "start": 9.581,
        "end": 9.973,
        "src_start": 17.181,
        "highlight": false
      },
      {
        "text": "from",
        "start": 10.007,
        "end": 10.398,
        "src_start": 17.607,
        "highlight": false
      },
      {
        "text": "40%",
        "start": 10.432,
        "end": 10.745,
        "src_start": 18.032,
        "highlight": true
      },
      {
        "text": "to",
        "start": 10.773,
        "end": 11.008,
        "src_start": 18.373,
        "highlight": false
      },
      {
        "text": "70%",
        "start": 11.028,
        "end": 11.341,
        "src_start": 18.628,
        "highlight": true
      },
      {
        "text": "completion.",
        "start": 11.369,
        "end": 12.308,
        "src_start": 18.969,
        "highlight": false
      },
      {
        "text": "Follow.",
        "start": 12.473,
        "end": 12.942,
        "src_start": 21.34,
        "highlight": false
      },
      {
        "text": "Day",
        "start": 13.077,
        "end": 13.326,
        "src_start": 22.11,
        "highlight": false
      },
      {
        "text": "13",
        "start": 13.348,
        "end": 13.534,
        "src_start": 22.381,
        "highlight": true
      },
      {
        "text": "tomorrow.",
        "start": 13.551,
        "end": 14.173,
        "src_start": 22.584,
        "highlight": false
      }
    ]
  },
  "graphics": [],
  "audio": {
    "music": null,
    "sfx": [],
    "loudness_lufs": -14
  },
  "notes": [
    "auto: 24.5s source → 14.3s cut, 6 segments, 9 words removed",
    "NO HOOK TEXT — editor should add a hook_text graphic (≤7 words) at 0s"
  ]
}
